平成28年春期　問22	5月29日	テクノロジ系 _ ハードウェア __ハードウェア	RFIDの活用事例として，適切なものはどれか。	微小な無線チップによる人又は物の識別及び管理
平成31年春期　問80	5月29日	ストラテジ系 _ 法務 __標準化関連	インターネットで利用される技術の標準化を図り，技術仕様をRFCとして策定している組織はどれか。	IETF
平成21年秋期　問16	5月29日	テクノロジ系 _ システム構成要素 __システムの評価指標	3台のコンピュータA〜Cが図のように接続されている場合，システム全体の稼働率は幾らか。ここで，A〜Cの稼働率は，すべて0.8とする。また，コンピュータA，Bによって構成されている並列接続部分については，A，Bのいずれか1台でも稼働していれば，当該部分は稼働しているものとする。	0.768
令和4年度　問29	5月29日	テクノロジ系 _ データベース __トランザクション処理	データベースシステムにおいて，二つのプログラムが同一データへのアクセス要求を行うとき，後続プログラムのアクセス要求に対する並行実行の可否の組合せのうち，適切なものはどれか。ここで，表中の○は二つのプログラムが並行して実行されることを表し，×は先行プログラムの実行終了まで後続プログラムは待たされることを表す。	画像
令和5年度　問43	5月29日	マネジメント系 _ サービスマネジメント __サービスの運用	情報システムの障害対策の一つである縮退運用の説明はどれか。	障害箇所を切り離し，機能又は性能が低下してもシステムを稼働させ続けること
平成24年秋期　問27	5月29日	テクノロジ系 _ データベース __トランザクション処理	関係データベースの表の列に利用者がインデックスを設定する目的はどれか。	データの格納位置への効率的なアクセスが可能となり，検索速度の向上が期待できる。
令和6年度　問30	5月29日	テクノロジ系 _ セキュリティ __セキュリティ技術評価	ペネトレーションテストに該当するものはどれか。	公開Webサーバや組織のネットワークの脆弱性を探索し，サーバに実際に侵入できるかどうかを確認する。
令和4年度　問67	5月29日	ストラテジ系 _ 経営戦略マネジメント __経営戦略手法	企業の競争戦略におけるフォロワー戦略はどれか。	目標とする企業の戦略を観察し，迅速に模倣することで，開発や広告のコストを抑制し，市場での存続を図る。
平成30年春期　問44	5月29日	テクノロジ系 _ セキュリティ __情報セキュリティ対策	社内ネットワークとインターネットの接続点に，ステートフルインスペクション機能をもたない，静的なパケットフィルタリング型のファイアウォールを設置している。このネットワーク構成において，社内のPCからインターネット上のSMTPサーバに電子メールを送信できるようにするとき，ファイアウォールで通過を許可するTCPパケットのポート番号の組合せはどれか。ここで，SMTP通信には，デフォルトのポート番号を使うものとする。	
平成30年秋期　問80	5月29日	ストラテジ系 _ 法務 __労働関連・取引関連法規	請負契約を締結していても，労働者派遣とみなされる受託者の行為はどれか。	休暇取得の承認を発注者側の指示に従って行う。